displayName,userPrincipalName,sourceTenant,identityType,companyName,department,jobTitle,officeLocation,extensionAttribute1_role,extensionAttribute2_ownedLocations,extensionAttribute3_accessProfile,baselineGroups,functionalGroups,locationGroups,mailboxes,apps,notes
Tyler Granlund,tyler.granlund@httbrands.com,httbrands.com,CrossTenantPilot,Delta Crown Extensions,Delta Crown Operations,Manager,DCE-LV,Leadership,DCE-LV,DCE-CrossTenant-Test,"AllStaff;Managers;DCE-CrossTenant-Pilot","DCE-Leadership;DCE-Operations",DCE-Loc-LV,"operations@deltacrown.com;info@deltacrown.com","<pilot-app-if-needed>",Pilot validation user for cross-tenant access; verify synced DCE object appears as Member before attribute labeling
Lindy Sturgill,lindy.sturgill@deltacrown.com,deltacrown.com,Internal,Delta Crown Extensions,Delta Crown Operations,Manager,DCE-LV,Operations,DCE-LV,DCE-Leadership,"AllStaff;Managers","DCE-Operations;DCE-Leadership",DCE-Loc-LV,"operations@deltacrown.com;info@deltacrown.com",,Known licensed mailbox activation user from deployment status; role/location assumed pending business confirmation
Allynn Shepherd,allynn.shepherd@deltacrown.com,deltacrown.com,Internal,Delta Crown Extensions,Delta Crown Client Services,Manager,DCE-PHX,ClientServices,DCE-PHX,DCE-Leadership,"AllStaff;Managers",DCE-ClientServices,DCE-Loc-PHX,"bookings@deltacrown.com",,Native DCE user from Exchange quickstart; department/title/location are first-pass assumptions for validation
Jay Miller,jay.miller@deltacrown.com,deltacrown.com,Internal,Delta Crown Extensions,Delta Crown Operations,Stylist,DCE-LV,Stylist,DCE-LV,DCE-Standard,"AllStaff;Stylists",DCE-Operations,DCE-Loc-LV,bookings@deltacrown.com,,Native DCE user from Exchange quickstart; title/location assumed from current stylist group model
Sarah Miller,sarah.miller@deltacrown.com,deltacrown.com,Internal,Delta Crown Extensions,Delta Crown Marketing,Marketing Coordinator,DCE-DAL,Marketing,DCE-DAL,DCE-Standard,AllStaff,DCE-Marketing,DCE-Loc-DAL,,"<marketing-app-if-needed>",Native DCE user from Exchange quickstart; mapped to marketing workload based on current site/channel architecture and should be confirmed
